{
  "schema_version": "1.0",
  "report_id": "2026-09-29-IR-TSE-1200",
  "market": "iran_stock",
  "generated_at": "2026-09-29T12:06:53+03:30",
  "agent": {
    "name": "Iran Stock Chief Analyst & Final Auditor",
    "workflow": "market-intelligence-hub/prompts/iran-stock-auditor.md",
    "contract": "market-intelligence-hub/prompts/shared-analysis-contract.md",
    "prompt_version": "1.1",
    "contract_version": "1.2",
    "run_mode": "INDEPENDENT_FALLBACK"
  },
  "scout_report_found": false,
  "scout_validation": [],
  "missed_candidates": [
    {
      "symbol": "فخوز",
      "label": "INDEPENDENT_WATCH",
      "risk_reward": null,
      "rank": 1,
      "decision": "WATCH_ONLY",
      "current_price_irr": 3207,
      "close_price_irr": 3206,
      "pe": 14.4,
      "volume_shares": 2485901286,
      "trade_value_billion_toman": 7964.8,
      "trade_value_vs_30d_average": 2.082,
      "real_money_flow_billion_toman": 891.7,
      "buyer_power": 1.12,
      "demand_volume": 407800000,
      "supply_volume": 29800,
      "year_high_irr": 3207,
      "core_fundamental_status": "DATA_NOT_VERIFIED",
      "fundamental_status": "FUNDAMENTAL_REVIEW_REQUIRED_NO_BASELINE",
      "technical_status": "DATA_NOT_VERIFIED",
      "relative_volume": "DATA_NOT_VERIFIED",
      "news_status": "DATA_NOT_VERIFIED",
      "critical_news_risk": "DATA_NOT_VERIFIED",
      "entry_zone": null,
      "stop_loss": null,
      "target_1": null,
      "target_2": null,
      "target_3": null,
      "action": "NO_ACTION",
      "reason": "Strong liquidity, current trade value about 2.08x the 30-session average and positive retail flow, but price is at a fresh 52-week high. The new monthly filing is unreviewed and no structural stop/target or canonical fundamental score exists."
    },
    {
      "symbol": "فولاد",
      "label": "INDEPENDENT_WATCH",
      "risk_reward": null,
      "rank": 2,
      "decision": "WATCH_ONLY",
      "current_price_irr": 3520,
      "close_price_irr": 3520,
      "pe": 6.8,
      "volume_shares": 2394216834,
      "trade_value_billion_toman": 8420.5,
      "trade_value_vs_30d_average": 0.757,
      "real_money_flow_billion_toman": 535.1,
      "buyer_power": 1.45,
      "demand_volume": 2000000000,
      "supply_volume": 0,
      "year_high_irr": 4490,
      "core_fundamental_status": "DATA_NOT_VERIFIED",
      "fundamental_status": "INITIAL_BASELINE_NOT_ESTABLISHED",
      "technical_status": "DATA_NOT_VERIFIED",
      "relative_volume": "DATA_NOT_VERIFIED",
      "news_status": "DATA_NOT_VERIFIED",
      "critical_news_risk": "DATA_NOT_VERIFIED",
      "entry_zone": null,
      "stop_loss": null,
      "target_1": null,
      "target_2": null,
      "target_3": null,
      "action": "NO_ACTION",
      "reason": "Best large-cap liquidity and low observed P/E with positive retail flow, but it is locked at the upper price, current value remains below the 30-session average and full technical/news/RR validation is missing."
    },
    {
      "symbol": "شپنا",
      "label": "REJECTED_TAPE",
      "risk_reward": null,
      "rank": 3,
      "decision": "REJECTED",
      "current_price_irr": 13410,
      "close_price_irr": 13320,
      "pe": 7.3,
      "volume_shares": 437900000,
      "trade_value_billion_toman": 5834.9,
      "trade_value_vs_30d_average": 0.577,
      "real_money_flow_billion_toman": -138.4,
      "buyer_power": 0.81,
      "demand_volume": 1000000,
      "supply_volume": 6400000,
      "year_high_irr": 14670,
      "core_fundamental_status": "DATA_NOT_VERIFIED",
      "fundamental_status": "INITIAL_BASELINE_NOT_ESTABLISHED",
      "technical_status": "DATA_NOT_VERIFIED",
      "relative_volume": "DATA_NOT_VERIFIED",
      "news_status": "DATA_NOT_VERIFIED",
      "critical_news_risk": "DATA_NOT_VERIFIED",
      "entry_zone": null,
      "stop_loss": null,
      "target_1": null,
      "target_2": null,
      "target_3": null,
      "action": "NO_ACTION",
      "reason": "Price strength was not supported by tape: retail outflow, buyer power below one, displayed supply around 6.4x demand and current value only 57.7% of the 30-session average."
    },
    {
      "symbol": "صبا",
      "label": "REJECTED_DISTRIBUTION_RISK",
      "risk_reward": null,
      "rank": 4,
      "decision": "REJECTED",
      "current_price_irr": 10270,
      "close_price_irr": 10220,
      "pe": 11.8,
      "volume_shares": 566500000,
      "trade_value_billion_toman": 5789.6,
      "trade_value_vs_30d_average": 2.442,
      "real_money_flow_billion_toman": 2073.5,
      "buyer_power": 0.46,
      "demand_volume": 2600000,
      "supply_volume": 10800000,
      "year_high_irr": 10270,
      "core_fundamental_status": "DATA_NOT_VERIFIED",
      "fundamental_status": "FUNDAMENTAL_REVIEW_REQUIRED_NO_BASELINE",
      "technical_status": "DATA_NOT_VERIFIED",
      "relative_volume": "DATA_NOT_VERIFIED",
      "news_status": "DATA_NOT_VERIFIED",
      "critical_news_risk": "DATA_NOT_VERIFIED",
      "entry_zone": null,
      "stop_loss": null,
      "target_1": null,
      "target_2": null,
      "target_3": null,
      "action": "NO_ACTION",
      "reason": "High turnover and reported positive money flow conflict with weak 0.46 buyer power and displayed supply about 4.15x demand at a fresh 52-week high. The new monthly filing is unreviewed."
    }
  ],
  "finalists": [],
  "market_action_status": "NO_ACTION",
  "data_quality": {
    "overall": "LIMITED_FOR_ACTION",
    "scout_status": "SCOUT_NOT_AVAILABLE",
    "expected_report_id": "2026-09-29-IR-TSE-1200",
    "scout_checked_at": "2026-09-29T12:06:53+03:30",
    "auditor_extraction_time": "2026-09-29T12:06:53+03:30",
    "source_data_date": "1405-07-07 / 2026-09-29",
    "market_coverage_claim": "Current market overview and first-page liquidity ranking were reviewed; no claim of full independent symbol-by-symbol coverage.",
    "symbols_deep_reviewed": 4,
    "incomplete_symbols": 4,
    "market_breadth": {
      "positive": 842,
      "negative": 204,
      "unchanged": 55,
      "traded": 1101,
      "positive_to_negative_ratio": 4.13,
      "symbols_at_price_cap": 531,
      "symbols_at_price_floor": 22
    },
    "market_metrics": {
      "total_trade_value_billion_toman": 23160,
      "total_trade_volume_billion_shares": 57.43,
      "average_pe": 14.52
    },
    "market_money_flow": {
      "status": "DATA_CONFLICT",
      "value_a_billion_toman": 4135,
      "value_b_billion_toman": -31097.2,
      "detail": "The dedicated indicators page showed +4,135 billion toman, while the live market page showed 31,097.2 billion toman outflow for the same date."
    },
    "has_new_fundamental_evidence_appeared": "YES_FOR_FKHOUZ_AND_SABA_AS_UNREVIEWED_MONTHLY_FILINGS; NOT_ESTABLISHED_FOR_OTHERS",
    "fundamental_changes": [],
    "semantic_validation": "PASS",
    "limitations": [
      "Same-day canonical Scout JSON was absent after repeated GitHub checks; this report used independent fallback and contains no Scout comparison or High Conviction label.",
      "All four reviewed canonical fundamental state files were absent; no Core Fundamental score was invented.",
      "Direct TSETMC endpoints were not retrievable; current Tindex pages citing TSETMC were used as the live cross-check.",
      "Market-wide real-money flow is DATA_CONFLICT and excluded from ranking.",
      "Adjusted historical candles, EMA20/50/100/200, RSI14, MACD, full weekly structure and structural stop/target levels were not independently reconstructed.",
      "Relative volume was not verified; trade-value-to-30-session-average is reported separately.",
      "Current-session candles were not treated as closed and order depth is a point-in-time snapshot.",
      "Full current news and geopolitical coverage was unavailable; Critical News Risk remains DATA_NOT_VERIFIED."
    ],
    "sources": [
      {
        "name": "Tindex live Tehran market",
        "url": "https://tindex.app/stocks/",
        "date": "1405-07-07",
        "role": "current market breadth, liquidity, symbol ranking; cites TSETMC"
      },
      {
        "name": "Tindex market indicators",
        "url": "https://tindex.app/indicators/tse-market/",
        "date": "1405-07-07",
        "role": "cross-check of aggregate market metrics"
      },
      {
        "name": "Tindex screener",
        "url": "https://tindex.app/stocks/screener/",
        "date": "1405-07-07",
        "role": "full-market secondary screen"
      },
      {
        "name": "Tindex فولاد",
        "url": "https://tindex.app/stocks/%D9%81%D9%88%D9%84%D8%A7%D8%AF/",
        "date": "1405-07-07",
        "role": "candidate cross-check"
      },
      {
        "name": "Tindex فخوز",
        "url": "https://tindex.app/stocks/%D9%81%D8%AE%D9%88%D8%B2/",
        "date": "1405-07-07",
        "role": "candidate cross-check"
      },
      {
        "name": "Tindex شپنا",
        "url": "https://tindex.app/stocks/%D8%B4%D9%BE%D9%86%D8%A7/",
        "date": "1405-07-07",
        "role": "candidate cross-check"
      },
      {
        "name": "Tindex صبا",
        "url": "https://tindex.app/stocks/%D8%B5%D8%A8%D8%A7/",
        "date": "1405-07-07",
        "role": "candidate cross-check"
      }
    ]
  }
}
